{"operation":"CONTENT_EXTRACTION","inputArtifactId":"00000000-0000-4000-8000-000000000102","structuredOutput":{"artifactId":"00000000-0000-4000-8000-000000000601","artifactClass":"STAGING","role":"STRUCTURED","key":"staging/00000000-0000-4000-8000-000000000302/00000000-0000-4000-8000-000000000402/content.json","mediaType":"application/json","byteLength":256,"checksumAlgorithm":"SHA256","checksum":"1111111111111111111111111111111111111111111111111111111111111111","immutable":false,"createdAt":"2026-07-15T00:00:02.000Z"},"textOutput":null,"titlePresent":true,"mainContentPresent":true,"detectedLanguage":"ar","textDirection":"RTL","fieldCount":4,"linkCount":2,"tableCount":1,"confidence":0.98,"fieldProvenanceOutput":{"artifactId":"00000000-0000-4000-8000-000000000602","artifactClass":"STAGING","role":"MANIFEST","key":"staging/00000000-0000-4000-8000-000000000302/00000000-0000-4000-8000-000000000402/provenance.json","mediaType":"application/json","byteLength":128,"checksumAlgorithm":"SHA256","checksum":"2222222222222222222222222222222222222222222222222222222222222222","immutable":false,"createdAt":"2026-07-15T00:00:02.000Z"},"warnings":[],"metrics":{"wallTimeMs":500,"peakMemoryBytes":1000000,"bytesRead":2048,"bytesWritten":384},"derivation":{"inputChecksums":["ffffffffffffffffffffffffffffffffffffffffffffffffffffffffffffffff"],"provider":{"providerId":"reference.html","providerVersion":"1.0.0","adapterVersion":"1.0.0"},"optionsDigest":"3333333333333333333333333333333333333333333333333333333333333333","modelDigests":[]}}
